<?xml version="1.0" encoding="UTF-8" ?>
<!DOCTYPE Persons SYSTEM "Person.dtd">
<Persons>
    <Person>
        <Email>myemail@it.by</Email>
        <NickName>MyNickName</NickName>
        <Password>qwerty</Password>
        <Ads>
            <Ad>
                <Description>новый автомобиль</Description>
                <Brend>Skoda</Brend>
                <Model>Rapid</Model>
                <CapasityEngine>1.6</CapasityEngine>
                <CarBody>лифтбэк</CarBody>
            </Ad>
            <Ad>
                <Description>старый автомобиль</Description>
                <Brend>Skoda</Brend>
                <Model>fabia</Model>
                <CapasityEngine>1.4</CapasityEngine>
                <CarBody>универсал</CarBody>
            </Ad>
        </Ads>
    </Person>
</Persons>